No.     Time           Source                Destination           Protocol Length Info     26 10.329978000   2607:f5c0:8010:c0de:4516:3:0:5 2607:f5c0:8010:c0de:4516:3:0:2 TCP      132    pnbscada > 33329 [PSH, ACK] Seq=1 Ack=1 Win=232 Len=46 TSval=7070115 TSecr=222916560Frame 26: 132 bytes on wire (1056 bits), 132 bytes captured (1056 bits) on interface 0    Interface id: 0    Encapsulation type: Ethernet (1)    Arrival Time: Dec  2, 2014 22:54:52.032278000 EST    [Time shift for this packet: 0.000000000 seconds]    Epoch Time: 1417578892.032278000 seconds    [Time delta from previous captured frame: 1.983340000 seconds]    [Time delta from previous displayed frame: 1.983340000 seconds]    [Time since reference or first frame: 10.329978000 seconds]    Frame Number: 26    Frame Length: 132 bytes (1056 bits)    Capture Length: 132 bytes (1056 bits)    [Frame is marked: False]    [Frame is ignored: False]    [Protocols in frame: eth:ipv6:tcp:data]    [Coloring Rule Name: TCP]    [Coloring Rule String: tcp]Ethernet II, Src: CadmusCo_d9:f4:01 (08:00:27:d9:f4:01), Dst: RealtekU_45:16:0a (52:54:00:45:16:0a)    Destination: RealtekU_45:16:0a (52:54:00:45:16:0a)        Address: RealtekU_45:16:0a (52:54:00:45:16:0a)        .... ..1. .... .... .... .... = LG bit: Locally administered address (this is NOT the factory default)        .... ...0 .... .... .... .... = IG bit: Individual address (unicast)    Source: CadmusCo_d9:f4:01 (08:00:27:d9:f4:01)        Address: CadmusCo_d9:f4:01 (08:00:27:d9:f4:01)        .... ..0. .... .... .... .... = LG bit: Globally unique address (factory default)        .... ...0 .... .... .... .... = IG bit: Individual address (unicast)    Type: IPv6 (0x86dd)Internet Protocol Version 6, Src: 2607:f5c0:8010:c0de:4516:3:0:5 (2607:f5c0:8010:c0de:4516:3:0:5), Dst: 2607:f5c0:8010:c0de:4516:3:0:2 (2607:f5c0:8010:c0de:4516:3:0:2)    0110 .... = Version: 6        [0110 .... = This field makes the filter "ip.version == 6" possible: 6]    .... 0000 0000 .... .... .... .... .... = Traffic class: 0x00000000        .... 0000 00.. .... .... .... .... .... = Differentiated Services Field: Default (0x00000000)        .... .... ..0. .... .... .... .... .... = ECN-Capable Transport (ECT): Not set        .... .... ...0 .... .... .... .... .... = ECN-CE: Not set    .... .... .... 0000 0000 0000 0000 0000 = Flowlabel: 0x00000000    Payload length: 78    Next header: TCP (6)    Hop limit: 64    Source: 2607:f5c0:8010:c0de:4516:3:0:5 (2607:f5c0:8010:c0de:4516:3:0:5)    Destination: 2607:f5c0:8010:c0de:4516:3:0:2 (2607:f5c0:8010:c0de:4516:3:0:2)    [Source GeoIP: Unknown]    [Destination GeoIP: Unknown]Transmission Control Protocol, Src Port: pnbscada (3875), Dst Port: 33329 (33329), Seq: 1, Ack: 1, Len: 46    Source port: pnbscada (3875)    Destination port: 33329 (33329)    [Stream index: 4]    Sequence number: 1    (relative sequence number)    [Next sequence number: 47    (relative sequence number)]    Acknowledgment number: 1    (relative ack number)    Header length: 32 bytes    Flags: 0x018 (PSH, ACK)        000. .... .... = Reserved: Not set        ...0 .... .... = Nonce: Not set        .... 0... .... = Congestion Window Reduced (CWR): Not set        .... .0.. .... = ECN-Echo: Not set        .... ..0. .... = Urgent: Not set        .... ...1 .... = Acknowledgment: Set        .... .... 1... = Push: Set        .... .... .0.. = Reset: Not set        .... .... ..0. = Syn: Not set        .... .... ...0 = Fin: Not set    Window size value: 232    [Calculated window size: 232]    [Window size scaling factor: -1 (unknown)]    Checksum: 0x43fc [validation disabled]        [Good Checksum: False]        [Bad Checksum: False]    Options: (12 bytes), No-Operation (NOP), No-Operation (NOP), Timestamps        No-Operation (NOP)            Type: 1                0... .... = Copy on fragmentation: No                .00. .... = Class: Control (0)                ...0 0001 = Number: No-Operation (NOP) (1)        No-Operation (NOP)            Type: 1                0... .... = Copy on fragmentation: No                .00. .... = Class: Control (0)                ...0 0001 = Number: No-Operation (NOP) (1)        Timestamps: TSval 7070115, TSecr 222916560            Kind: Timestamp (8)            Length: 10            Timestamp value: 7070115            Timestamp echo reply: 222916560    [SEQ/ACK analysis]        [Bytes in flight: 46]Data (46 bytes)0000  20 5e 05 00 00 27 00 61 6c 69 61 73 20 73 68 6f    ^...'.alias sho0010  77 20 68 6f 73 74 32 2e 74 65 61 6d 33 2e 34 35   w host2.team3.450020  31 36 2e 63 73 2e 77 70 69 2e 65 64 75 00         16.cs.wpi.edu.    Data: 205e0500002700616c6961732073686f7720686f7374322e...    [Length: 46]